category,weight,direction,biological_rationale,assay_reliability,sample_features,justification_for_supplement
layer_presence,0.20,positive,"Biomarker로서 가치는 multi-modal evidence가 있을 때 강해진다. RNA only는 transcript fluctuation, protein only는 dilution/PTM 영향. 4 layer 동시 support는 cross-modality robustness.","All 4 layers measurable in our atlas (RNA bulk × 4 cohort, protein TMT × 2 cohort, scRNA × 10 cohort, serum DIA × 3 cohort).","layer_count (0-4), rna_present, prot_present, scrna_present, serum_present","4 evidence layers each contribute equally; sum normalized to [0,1]"
direction_agreement,0.20,positive,"진짜 stage-onset signal이라면 cohort 간 + layer 간 direction이 일치해야. RNA UP에서 Protein UP, multi-cohort consensus가 *true signal* 신호. Inversion(LTBP1 RNA UP × Serum DOWN 같은 case는 별도 carefully)","DESeq2 sign + limma sign + scRNA trend slope sign + serum log2FC sign — direct binary direction.","cross_cohort_sign_concordance, cross_layer_sign_concordance, voting_score","Cross-cohort + cross-layer voting; both contribute equally"
early_pattern_concentration,0.20,positive,"4-Early-pattern framework의 핵심: Stage I-onset signal을 standard 4 template에 매칭. 'shape match'이 marker의 prerequisite (early-stage detection 가능 조건).","Pearson ρ vs 4 template — robust shape correlation; LRT padj on stage effect.","max_rho_early_pattern, lrt_padj, pattern_assignment_one_hot","Required for early-stage relevance; high rho without effect size still concentrated to early window"
heterogeneity_penalty,-0.15,negative,"Cohort heterogeneity가 큰 신호는 *artifact* 위험 (LTBP1 case처럼 1 cohort가 끌어올린 평균). I² ≥ 50%면 random-effects meta가 0 근처로 수렴 — true sustained signal 부정.","metafor REML + I² statistic; 잘 검증된 meta-analysis methodology.","max_I2_meta, mean_I2_across_contrasts, stouffer_p_inverse","Higher I² → larger penalty; I² >= 70% receives full penalty"
leakage_penalty,-0.10,negative,"Housekeeping (HK) genes는 stage-specific signal로 보일 수 있으나 *생물학적 baseline* 흔들림에 불과. 또 plasma high-abundance는 abundance 자체로 detection 가능 (≠ marker quality). 이 둘을 explicit penalize.","HPA housekeeping list (Eisenberg 2013 / Hounkpe 2021) + Anderson 2002 plasma high-abundance reference. Public, curated.","is_housekeeping (binary), gtex_baseline_quantile (0-1), plasma_high_abundance (binary)","HK genes: full penalty -1.0; plasma top decile: -0.5; both: -1.0 capped"
serum_bridge,0.10,positive,"Tissue → serum translation success가 PDAC marker의 진짜 가치. Tissue marker 중 *secreted + serum-detectable*이 임상 적용 가능. Direction concordance + serum AUC + detection robustness.","DIA proteomics 3 cohort + signal peptide annotation (UniProt). 잘 검증된 features.","serum_detected (binary), tissue_serum_direction_concordant (binary), signal_peptide_present (binary), serum_pdac_meta_padj","Required for serum-deliverable marker; absent → 0 contribution"
rescue_signal,0.05,positive,"RNA-only weak/artifact여도 protein/scRNA/serum이 강한 case (LTBP1처럼). 이런 case는 *RNA bulk artifact*에 가려진 진짜 신호일 수 있음. 작은 weight로 'multi-modal rescue' 인정.","Computed from layer disagreement: RNA tier ARTIFACT/OTHER but other layers GOLD/SILVER 패턴.","rna_weak_other_strong (binary), max_other_layer_strength","Weight intentionally small (0.05) — 신호이지 main contribution 아님"
